A1: Stack and Compiler Versions
A2: TCP/IP Stack v5.36.2
A3: MPLAB C Compiler for PIC18 MCUs (C18) v3.38
A4: MPLAB C Compiler for PIC24 MCUs and dsPIC DSCs (C30) v3.25
A5: MPLAB C Compiler for PIC32 MCUs (C32) v1.12
A7: Wired test setup: Connect the board under test directly to a computer using a crossover cable. Follow the TCPIP Stack Help file's instructions for the TCP/UDP Performance Test.
A8: Wireless test setup: Connect the PC to a router with a Category 5 cable. Connect the demo board to the router wirelessly Follow the TCPIP Stack Help file's instructions for the TCP/UDP Performance Test.
A10: Microcontroller | B10: MIPS | C10: Network Controller | D10: Interface | E10: LAN Transmit Throughput (Kbytes/sec) | I10: Internet Transmit Throughput at 100ms ping (estimated Kbytes/sec)(1) | M10: Compiler | N10: Optimization | O10: Test Boards
E11: TCP with 200 byte TX FIFO | F11: TCP with 2000 byte TX FIFO | G11: TCP with 8000 byte TX FIFO | H11: UDP | I11: TCP with 200 byte TX FIFO | J11: TCP with 2000 byte TX FIFO | K11: TCP with 8000 byte TX FIFO | L11: UDP
A12: PIC18F97J60 | B12: 10.4 | C12: Internal 10BaseT | D12: - | E12: 33.9 | F12: 75.8 | G12: N/A | H12: 113 | I12: =IF(E12>0.2/0.1, IF(ISNUMBER(E12),0.2/0.1,E12),E12) -> 2 | J12: =IF(F12>2/0.1, IF(ISNUMBER(F12),2/0.1,F12),F12) -> 20 | K12: =IF(G12>8/0.1, IF(ISNUMBER(G12),8/0.1,G12),G12) -> N/A | L12: =H12 -> 113 | M12: C18 | N12: Debug | O12: PICDEM.net 2
A13: PIC18F8722 | B13: 10 | C13: ENC28J60 | D13: SPI, 10 MHz | E13: 20.5 | F13: 45.2 | G13: N/A | H13: 63 | I13: =IF(E13>0.2/0.1, IF(ISNUMBER(E13),0.2/0.1,E13),E13) -> 2 | J13: =IF(F13>2/0.1, IF(ISNUMBER(F13),2/0.1,F13),F13) -> 20 | K13: =IF(G13>8/0.1, IF(ISNUMBER(G13),8/0.1,G13),G13) -> N/A | L13: =H13 -> 63 | M13: C18 | N13: Debug | O13: PIC18 Explorer, Ethernet PICtail
A14: PIC24FJ128GA010 | B14: 16 | C14: ENC28J60 | D14: SPI, 8 MHz | E14: 55.5 | F14: 136.1 | G14: N/A | H14: 203 | I14: =IF(E14>0.2/0.1, IF(ISNUMBER(E14),0.2/0.1,E14),E14) -> 2 | J14: =IF(F14>2/0.1, IF(ISNUMBER(F14),2/0.1,F14),F14) -> 20 | K14: =IF(G14>8/0.1, IF(ISNUMBER(G14),8/0.1,G14),G14) -> N/A | L14: =H14 -> 203 | M14: C30 | N14: s (min size) | O14: Explorer 16, Ethernet PICtail Plus
A15: dsPIC33FJ256GP710(2) | B15: 40 | C15: ENC28J60 | D15: SPI, 8 MHz | E15: 74.8 | F15: 199.5 | G15: N/A | H15: 258 | I15: =IF(E15>0.2/0.1, IF(ISNUMBER(E15),0.2/0.1,E15),E15) -> 2 | J15: =IF(F15>2/0.1, IF(ISNUMBER(F15),2/0.1,F15),F15) -> 20 | K15: =IF(G15>8/0.1, IF(ISNUMBER(G15),8/0.1,G15),G15) -> N/A | L15: =H15 -> 258 | M15: C30 | N15: s (min size) | O15: Explorer 16, Ethernet PICtail Plus
A16: PIC32MX360F512L | B16: 80 | C16: ENC28J60 | D16: SPI, 20 MHz | E16: 109.6 | F16: 347.4 | G16: N/A | H16: 461 | I16: =IF(E16>0.2/0.1, IF(ISNUMBER(E16),0.2/0.1,E16),E16) -> 2 | J16: =IF(F16>2/0.1, IF(ISNUMBER(F16),2/0.1,F16),F16) -> 20 | K16: =IF(G16>8/0.1, IF(ISNUMBER(G16),8/0.1,G16),G16) -> N/A | L16: =H16 -> 461 | M16: C32 | N16: s (min size) | O16: Explorer 16, Ethernet PICtail Plus
A17: PIC32MX795F512L | B17: 80 | C17: ENC28J60 | D17: SPI, 20 MHz | E17: 115.2 | F17: 363.2 | G17: N/A | H17: 456 | I17: =IF(E17>0.2/0.1, IF(ISNUMBER(E17),0.2/0.1,E17),E17) -> 2 | J17: =IF(F17>2/0.1, IF(ISNUMBER(F17),2/0.1,F17),F17) -> 20 | K17: =IF(G17>8/0.1, IF(ISNUMBER(G17),8/0.1,G17),G17) -> N/A | L17: =H17 -> 456 | M17: C32 | N17: s (min size) | O17: Explorer 16, Ethernet PICtail Plus
A18: PIC18F8722 | B18: 10 | C18: ENC624J600(3) | D18: SPI, 10 MHz | E18: 27.7 | F18: 76.3 | G18: 79.9 | H18: 114 | I18: =IF(E18>0.2/0.1, IF(ISNUMBER(E18),0.2/0.1,E18),E18) -> 2 | J18: =IF(F18>2/0.1, IF(ISNUMBER(F18),2/0.1,F18),F18) -> 20 | K18: =IF(G18>8/0.1, IF(ISNUMBER(G18),8/0.1,G18),G18) -> 79.9 | L18: =H18 -> 114 | M18: C18 | N18: Debug | O18: PIC18 Explorer, Fast 100Mbps Ethernet PICtail Plus
A19: PIC24FJ128GA010 | B19: 16 | C19: ENC624J600(3) | D19: SPI, 8 MHz | E19: 57.2 | F19: 168.4 | G19: 183.4 | H19: 362 | I19: =IF(E19>0.2/0.1, IF(ISNUMBER(E19),0.2/0.1,E19),E19) -> 2 | J19: =IF(F19>2/0.1, IF(ISNUMBER(F19),2/0.1,F19),F19) -> 20 | K19: =IF(G19>8/0.1, IF(ISNUMBER(G19),8/0.1,G19),G19) -> 80 | L19: =H19 -> 362 | M19: C30 | N19: s (min size) | O19: Explorer 16, Fast 100Mbps Ethernet PICtail Plus
A20: dsPIC33FJ256GP710(2) | B20: 40 | C20: ENC624J600(3) | D20: SPI, 8 MHz | E20: 93.7 | F20: 290.9 | G20: 320.8 | H20: 553.6 | I20: =IF(E20>0.2/0.1, IF(ISNUMBER(E20),0.2/0.1,E20),E20) -> 2 | J20: =IF(F20>2/0.1, IF(ISNUMBER(F20),2/0.1,F20),F20) -> 20 | K20: =IF(G20>8/0.1, IF(ISNUMBER(G20),8/0.1,G20),G20) -> 80 | L20: =H20 -> 553.6 | M20: C30 | N20: s (min size) | O20: Explorer 16, Fast 100Mbps Ethernet PICtail Plus
A21: PIC32MX360F512L | B21: 80 | C21: ENC624J600(3) | D21: SPI, 13.33 MHz | E21: 142.1 | F21: 374.1 | G21: 421.2 | H21: 692 | I21: =IF(E21>0.2/0.1, IF(ISNUMBER(E21),0.2/0.1,E21),E21) -> 2 | J21: =IF(F21>2/0.1, IF(ISNUMBER(F21),2/0.1,F21),F21) -> 20 | K21: =IF(G21>8/0.1, IF(ISNUMBER(G21),8/0.1,G21),G21) -> 80 | L21: =H21 -> 692 | M21: C32 | N21: s (min size) | O21: Explorer 16, Fast 100Mbps Ethernet PICtail Plus
A22: PIC32MX795F512L | B22: 80 | C22: ENC624J600(3) | D22: SPI, 13.33 MHz | E22: 154.4 | F22: 411.6 | G22: 468.8 | H22: 784 | I22: =IF(E22>0.2/0.1, IF(ISNUMBER(E22),0.2/0.1,E22),E22) -> 2 | J22: =IF(F22>2/0.1, IF(ISNUMBER(F22),2/0.1,F22),F22) -> 20 | K22: =IF(G22>8/0.1, IF(ISNUMBER(G22),8/0.1,G22),G22) -> 80 | L22: =H22 -> 784 | M22: C32 | N22: s (min size) | O22: Explorer 16, Fast 100Mbps Ethernet PICtail Plus
A23: PIC24FJ128GA010 | B23: 16 | C23: ENC624J600(3) | D23: PSP Mode 5, PMP | E23: 101.1 | F23: 321.1 | G23: 362.8 | H23: 1028 | I23: =IF(E23>0.2/0.1, IF(ISNUMBER(E23),0.2/0.1,E23),E23) -> 2 | J23: =IF(F23>2/0.1, IF(ISNUMBER(F23),2/0.1,F23),F23) -> 20 | K23: =IF(G23>8/0.1, IF(ISNUMBER(G23),8/0.1,G23),G23) -> 80 | L23: =H23 -> 1028 | M23: C30 | N23: s (min size) | O23: Explorer 16, Fast 100Mbps Ethernet PICtail Plus
A24: dsPIC33FJ256GP710(2) | B24: 40 | C24: ENC624J600(3) | D24: PSP Mode 5, Bitbang | E24: 201.6 | F24: 711 | G24: 867.7 | H24: 2038 | I24: =IF(E24>0.2/0.1, IF(ISNUMBER(E24),0.2/0.1,E24),E24) -> 2 | J24: =IF(F24>2/0.1, IF(ISNUMBER(F24),2/0.1,F24),F24) -> 20 | K24: =IF(G24>8/0.1, IF(ISNUMBER(G24),8/0.1,G24),G24) -> 80 | L24: =H24 -> 2038 | M24: C30 | N24: s (min size) | O24: Explorer 16, Fast 100Mbps Ethernet PICtail Plus
A25: PIC32MX360F512L | B25: 80 | C25: ENC624J600(3) | D25: PSP Mode 5, PMP | E25: 200.3 | F25: 832.8 | G25: 1027 | H25: 2071 | I25: =IF(E25>0.2/0.1, IF(ISNUMBER(E25),0.2/0.1,E25),E25) -> 2 | J25: =IF(F25>2/0.1, IF(ISNUMBER(F25),2/0.1,F25),F25) -> 20 | K25: =IF(G25>8/0.1, IF(ISNUMBER(G25),8/0.1,G25),G25) -> 80 | L25: =H25 -> 2071 | M25: C32 | N25: s (min size) | O25: Explorer 16, Fast 100Mbps Ethernet PICtail Plus
A26: PIC32MX795F512L(3) | B26: 80 | C26: Internal 100BaseTX | D26: - | E26: 393.2 | F26: 1635 | G26: 2543 | H26: 8449 | I26: =IF(E26>0.2/0.1, IF(ISNUMBER(E26),0.2/0.1,E26),E26) -> 2 | J26: =IF(F26>2/0.1, IF(ISNUMBER(F26),2/0.1,F26),F26) -> 20 | K26: =IF(G26>8/0.1, IF(ISNUMBER(G26),8/0.1,G26),G26) -> 80 | L26: =H26 -> 8449 | M26: C32 | N26: s (min size) | O26: PIC32 Ethernet Starter Kit
A27: PIC18F97J60 | B27: 10.4 | C27: MRF24WB0M | D27: SPI, 10.4 MHz | E27: 5.4 | F27: 22.8 | G27: 30.3 | H27: 39.7 | I27: =IF(E27>0.2/0.1, IF(ISNUMBER(E27),0.2/0.1,E27),E27) -> 2 | J27: =IF(F27>2/0.1, IF(ISNUMBER(F27),2/0.1,F27),F27) -> 20 | K27: =IF(G27>8/0.1, IF(ISNUMBER(G27),8/0.1,G27),G27) -> 30.3 | L27: =H27 -> 39.7 | M27: C18 | N27: Debug | O27: PICDEM.net 2, MRF24WB0MA Wi-Fi PICtail Plus
A28: PIC24FJ256GB110 | B28: 16 | C28: MRF24WB0M | D28: SPI, 8 MHz | E28: 7.8 | F28: 42.6 | G28: 63.1 | H28: 47.7 | I28: =IF(E28>0.2/0.1, IF(ISNUMBER(E28),0.2/0.1,E28),E28) -> 2 | J28: =IF(F28>2/0.1, IF(ISNUMBER(F28),2/0.1,F28),F28) -> 20 | K28: =IF(G28>8/0.1, IF(ISNUMBER(G28),8/0.1,G28),G28) -> 63.1 | L28: =H28 -> 47.7 | M28: C30 | N28: s (min size) | O28: Explorer 16, MRF24WB0MA Wi-Fi PICtail Plus
A29: dsPIC33FJ256GP710(2) | B29: 40 | C29: MRF24WB0M | D29: SPI, 8 MHz | E29: 7.8 | F29: 44.7 | G29: 74.2 | H29: 47.5 | I29: =IF(E29>0.2/0.1, IF(ISNUMBER(E29),0.2/0.1,E29),E29) -> 2 | J29: =IF(F29>2/0.1, IF(ISNUMBER(F29),2/0.1,F29),F29) -> 20 | K29: =IF(G29>8/0.1, IF(ISNUMBER(G29),8/0.1,G29),G29) -> 74.2 | L29: =H29 -> 47.5 | M29: C30 | N29: s (min size) | O29: Explorer 16, MRF24WB0MA Wi-Fi PICtail Plus
A30: PIC32MX360F512L | B30: 80 | C30: MRF24WB0M | D30: SPI, 20 MHz | E30: 8.8 | F30: 51.1 | G30: 82.8 | H30: 47.7 | I30: =IF(E30>0.2/0.1, IF(ISNUMBER(E30),0.2/0.1,E30),E30) -> 2 | J30: =IF(F30>2/0.1, IF(ISNUMBER(F30),2/0.1,F30),F30) -> 20 | K30: =IF(G30>8/0.1, IF(ISNUMBER(G30),8/0.1,G30),G30) -> 80 | L30: =H30 -> 47.7 | M30: C32 | N30: s (min size) | O30: Explorer 16, MRF24WB0MA Wi-Fi PICtail Plus
A31: PIC32MX795F512L | B31: 80 | C31: MRF24WB0M | D31: SPI, 20 MHz | E31: 8.8 | F31: 53.2 | G31: 83.9 | H31: 43.6 | I31: =IF(E31>0.2/0.1, IF(ISNUMBER(E31),0.2/0.1,E31),E31) -> 2 | J31: =IF(F31>2/0.1, IF(ISNUMBER(F31),2/0.1,F31),F31) -> 20 | K31: =IF(G31>8/0.1, IF(ISNUMBER(G31),8/0.1,G31),G31) -> 80 | L31: =H31 -> 43.6 | M31: C32 | N31: s (min size) | O31: Explorer 16, MRF24WB0MA Wi-Fi PICtail Plus
A33: 1. Internet throughput with acknowledged protocols, such as TCP, are capped by the formula (Buffer Size)/(Ping Time). Assuming round trip acknowledgement latency cannot be controlled, bigger buffers must be used to increase throughput. Internet performance is derived from LAN throughput and is not measured.
A34: 2. Stack performance with a dsPIC33F is identical to a PIC24H device at the same processor clock. No DSP features are used by the TCP/IP stack.
A35: 3. ENC624J600 and PIC32MX7XX/6XX Internal 100BaseTX Ethernet measurements are done in 100Mbps, full duplex mode.